{
  "example": true,
  "$comment": "EXAMPLE — constructed working WLD seat for take-profit / stop trigger math. Not a live broker snapshot.",
  "asOf": "2026-09-18T17:30:00.000Z",
  "account": {
    "rhsAccountNumber": "813839826",
    "agenticAllowed": true
  },
  "mode": "DIVIDEND_15M",
  "equityUsd": 22,
  "buyingPowerUsd": 3,
  "sleeves": [
    {
      "symbol": "NEAR-USD",
      "role": "bank",
      "notionalUsd": 8.5,
      "peakNotionalUsd": 8.5
    },
    {
      "symbol": "CHIP-USD",
      "role": "bank",
      "notionalUsd": 3.4,
      "peakNotionalUsd": 3.4
    },
    {
      "symbol": "WLD-USD",
      "role": "working",
      "notionalUsd": 2.0,
      "peakNotionalUsd": 2.0,
      "costBasisUsd": 0.8,
      "markUsd": 0.83
    }
  ],
  "quotes": [
    { "symbol": "NEAR-USD", "bid": 5.1, "ask": 5.14, "mark": 5.12, "priorMark": 5.1, "mark15m": 5.22 },
    { "symbol": "CHIP-USD", "bid": 0.11, "ask": 0.111, "mark": 0.1105, "mark15m": 0.113 },
    { "symbol": "WLD-USD", "bid": 0.828, "ask": 0.832, "mark": 0.83, "priorMark": 0.8, "mark15m": 0.84 }
  ],
  "troughs": [],
  "day": {
    "date": "2026-09-18",
    "newWorkingEntries": 1,
    "realizedPnlUsd": null,
    "losingWorkingRoundTrips": 0
  }
}
