{
  "example": true,
  "$comment": "EXAMPLE — bottoms reclaim after green-only shelter. Working already sleeved to dust; trough on WLD. Not live fills.",
  "asOf": "2026-09-19T07:00:00.000Z",
  "account": {
    "rhsAccountNumber": "813839826",
    "agenticAllowed": true
  },
  "mode": "DIVIDEND_15M",
  "equityUsd": 20,
  "buyingPowerUsd": 4,
  "sleeves": [
    {
      "symbol": "NEAR-USD",
      "role": "bank",
      "notionalUsd": 13.7,
      "peakNotionalUsd": 13.7
    },
    {
      "symbol": "CHIP-USD",
      "role": "bank",
      "notionalUsd": 2.0,
      "peakNotionalUsd": 2.0
    },
    {
      "symbol": "WLD-USD",
      "role": "dust",
      "notionalUsd": 0.1,
      "peakNotionalUsd": 2.0
    },
    {
      "symbol": "ZEC-USD",
      "role": "working",
      "notionalUsd": 0.1,
      "peakNotionalUsd": 2.0,
      "costBasisUsd": 1.95,
      "markUsd": 2.0
    }
  ],
  "quotes": [
    { "symbol": "NEAR-USD", "bid": 3.62, "ask": 3.69, "mark": 3.65, "sessionOpen": 3.76, "priorMark": 3.6, "mark15m": 3.66 },
    { "symbol": "CHIP-USD", "bid": 0.0445, "ask": 0.0454, "mark": 0.045, "sessionOpen": 0.0469, "mark15m": 0.0452 },
    { "symbol": "WLD-USD", "bid": 0.393, "ask": 0.397, "mark": 0.395, "sessionOpen": 0.429, "priorMark": 0.388, "mark15m": 0.402 },
    { "symbol": "SEI-USD", "bid": 0.045, "ask": 0.046, "mark": 0.0455, "sessionOpen": 0.0485, "mark15m": 0.046 },
    { "symbol": "ENA-USD", "bid": 0.17, "ask": 0.172, "mark": 0.171, "sessionOpen": 0.183, "mark15m": 0.173 },
    { "symbol": "ZEC-USD", "bid": 1540, "ask": 1560, "mark": 1550, "sessionOpen": 1533, "priorMark": 1545, "mark15m": 1558 }
  ],
  "troughs": [
    {
      "symbol": "WLD-USD",
      "troughMark": 0.38,
      "troughAt": "2026-09-19T06:40:00.000Z",
      "windowMinutes": 20,
      "recentHigh": 0.42
    }
  ],
  "day": {
    "date": "2026-09-19",
    "newWorkingEntries": 1,
    "realizedPnlUsd": null,
    "losingWorkingRoundTrips": 0
  }
}
