{
  "example": true,
  "$comment": "EXAMPLE — fixture for tests. realizedPnlUsd is an input to the watcher, not a claimed live fill. Do not treat as real PnL.",
  "asOf": "2026-09-18T18:00:00.000Z",
  "account": {
    "rhsAccountNumber": "813839826",
    "agenticAllowed": true
  },
  "mode": "LOW_CAP_SLOW",
  "equityUsd": 20,
  "sleeves": [
    {
      "symbol": "NEAR-USD",
      "role": "bank",
      "notionalUsd": 8.5,
      "peakNotionalUsd": 8.5
    },
    {
      "symbol": "CHIP-USD",
      "role": "bank",
      "notionalUsd": 3.4,
      "peakNotionalUsd": 3.4
    }
  ],
  "quotes": [
    { "symbol": "NEAR-USD", "bid": 5.1, "ask": 5.14, "mark": 5.12 },
    { "symbol": "CHIP-USD", "bid": 0.11, "ask": 0.111, "mark": 0.1105 }
  ],
  "troughs": [],
  "day": {
    "date": "2026-09-18",
    "newWorkingEntries": 0,
    "realizedPnlUsd": -1,
    "losingWorkingRoundTrips": 0
  }
}
